{
  "schema_version": "groundsignal.ground-evidence.v1",
  "title": "模拟供应关系：独立证据、确认与反证",
  "mode": "synthetic",
  "created_at": "2026-04-03T08:00:00Z",
  "stale_after_days": 45,
  "entities": [
    {
      "id": "demo_supplier",
      "name": "演示芯片厂（虚构）",
      "aliases": []
    },
    {
      "id": "demo_customer",
      "name": "演示客户（虚构）",
      "aliases": []
    }
  ],
  "events": [
    {
      "id": "demo_supply_v1",
      "title": "虚构案例：演示芯片厂向演示客户供货",
      "event_type": "NEW_SUPPLIER",
      "entity_ids": [
        "demo_supplier",
        "demo_customer"
      ],
      "product": "演示加速卡 V1（虚构）",
      "event_time": null,
      "created_at": "2026-04-03T08:00:00Z"
    },
    {
      "id": "demo_supply_v2",
      "title": "虚构案例：V2 产品替代 V1",
      "event_type": "SUPPLIER_REPLACED",
      "entity_ids": [
        "demo_supplier",
        "demo_customer"
      ],
      "product": "演示加速卡 V2（虚构）",
      "event_time": "2026-05-28",
      "created_at": "2026-05-28T08:00:00Z"
    }
  ],
  "evidence": [
    {
      "id": "demo_qualification",
      "event_id": "demo_supply_v1",
      "evidence_type": "qualification",
      "source_url": "https://example.invalid/synthetic/qualification",
      "source_domain": "example.invalid",
      "source_tier": "T2",
      "published_at": "2026-04-03T08:00:00Z",
      "first_seen_at": "2026-04-03T08:00:00Z",
      "retrieved_at": "2026-04-03T08:00:00Z",
      "processed_at": "2026-04-03T08:00:00Z",
      "raw_fingerprint": "366c22cab0a6eaf80a2edac1db011d455ef7c2daee5e806787a853a797491323",
      "fingerprint_scope": "synthetic_document",
      "source_independence_group": null,
      "content_excerpt": "虚构资格资料：演示加速卡 V1 已通过演示客户的资格审核。",
      "access_mode": "synthetic_fixture",
      "original_source_checked": true,
      "legal_basis": {
        "public_access": "UNKNOWN",
        "auth_required": "UNKNOWN",
        "robots_reviewed": false,
        "tos_reviewed": false,
        "redistribution_status": "UNKNOWN",
        "personal_data": "UNASSESSED",
        "reviewer": null,
        "reviewed_at": null
      },
      "cited_source_url": null,
      "lineage": {
        "synthetic": true,
        "scenario": "issue_1_state_machine",
        "note": "全文、主体、来源和时间均为虚构测试材料"
      }
    },
    {
      "id": "demo_pilot",
      "event_id": "demo_supply_v1",
      "evidence_type": "delivery",
      "source_url": "https://example.invalid/synthetic/pilot",
      "source_domain": "example.invalid",
      "source_tier": "T2",
      "published_at": "2026-04-10T08:00:00Z",
      "first_seen_at": "2026-04-10T08:00:00Z",
      "retrieved_at": "2026-04-10T08:00:00Z",
      "processed_at": "2026-04-10T08:00:00Z",
      "raw_fingerprint": "6571b60620bac7d990dff5893ae320d38f8ea7796eec3d7cef0e97358d85da41",
      "fingerprint_scope": "synthetic_document",
      "source_independence_group": null,
      "content_excerpt": "虚构交付记录：演示客户已收到演示加速卡 V1 的试产批次。",
      "access_mode": "synthetic_fixture",
      "original_source_checked": true,
      "legal_basis": {
        "public_access": "UNKNOWN",
        "auth_required": "UNKNOWN",
        "robots_reviewed": false,
        "tos_reviewed": false,
        "redistribution_status": "UNKNOWN",
        "personal_data": "UNASSESSED",
        "reviewer": null,
        "reviewed_at": null
      },
      "cited_source_url": null,
      "lineage": {
        "synthetic": true,
        "scenario": "issue_1_state_machine",
        "note": "全文、主体、来源和时间均为虚构测试材料"
      }
    },
    {
      "id": "demo_reprint",
      "event_id": "demo_supply_v1",
      "evidence_type": "delivery",
      "source_url": "https://example.invalid/synthetic/reprint",
      "source_domain": "example.invalid",
      "source_tier": "T3",
      "published_at": "2026-04-11T08:00:00Z",
      "first_seen_at": "2026-04-11T08:00:00Z",
      "retrieved_at": "2026-04-11T08:00:00Z",
      "processed_at": "2026-04-11T08:00:00Z",
      "raw_fingerprint": "c5dd1ec6ec5a1c460925f3dbe8e62eeefc2f2460b53257f93a6e446c53bebf7c",
      "fingerprint_scope": "synthetic_document",
      "source_independence_group": null,
      "content_excerpt": "虚构转载：根据资格资料，演示加速卡 V1 已通过演示客户的资格审核。",
      "access_mode": "synthetic_fixture",
      "original_source_checked": true,
      "legal_basis": {
        "public_access": "UNKNOWN",
        "auth_required": "UNKNOWN",
        "robots_reviewed": false,
        "tos_reviewed": false,
        "redistribution_status": "UNKNOWN",
        "personal_data": "UNASSESSED",
        "reviewer": null,
        "reviewed_at": null
      },
      "cited_source_url": null,
      "lineage": {
        "synthetic": true,
        "scenario": "issue_1_state_machine",
        "note": "全文、主体、来源和时间均为虚构测试材料"
      }
    },
    {
      "id": "demo_confirmation",
      "event_id": "demo_supply_v1",
      "evidence_type": "delivery",
      "source_url": "https://example.invalid/synthetic/confirmation",
      "source_domain": "example.invalid",
      "source_tier": "T1",
      "published_at": "2026-05-21T08:00:00Z",
      "first_seen_at": "2026-05-21T08:00:00Z",
      "retrieved_at": "2026-05-21T08:00:00Z",
      "processed_at": "2026-05-21T08:00:00Z",
      "raw_fingerprint": "6d4cf95a9fa3918e50c9d1d75a7cc72c029465e0bb2d708f4dae0e536c67ce8b",
      "fingerprint_scope": "synthetic_document",
      "source_independence_group": null,
      "content_excerpt": "虚构客户公告：确认演示芯片厂为演示加速卡 V1 的供货方。",
      "access_mode": "synthetic_fixture",
      "original_source_checked": true,
      "legal_basis": {
        "public_access": "UNKNOWN",
        "auth_required": "UNKNOWN",
        "robots_reviewed": false,
        "tos_reviewed": false,
        "redistribution_status": "UNKNOWN",
        "personal_data": "UNASSESSED",
        "reviewer": null,
        "reviewed_at": null
      },
      "cited_source_url": null,
      "lineage": {
        "synthetic": true,
        "scenario": "issue_1_state_machine",
        "note": "全文、主体、来源和时间均为虚构测试材料"
      }
    },
    {
      "id": "demo_counter",
      "event_id": "demo_supply_v1",
      "evidence_type": "delivery",
      "source_url": "https://example.invalid/synthetic/counter",
      "source_domain": "example.invalid",
      "source_tier": "T2",
      "published_at": "2026-05-25T08:00:00Z",
      "first_seen_at": "2026-05-25T08:00:00Z",
      "retrieved_at": "2026-05-25T08:00:00Z",
      "processed_at": "2026-05-25T08:00:00Z",
      "raw_fingerprint": "7f493b331e6596c097fe731b699f20830139582b0a40d33c1971958abe6b5203",
      "fingerprint_scope": "synthetic_document",
      "source_independence_group": null,
      "content_excerpt": "虚构反证：一份争议材料称演示加速卡 V1 的批次未被验收。",
      "access_mode": "synthetic_fixture",
      "original_source_checked": true,
      "legal_basis": {
        "public_access": "UNKNOWN",
        "auth_required": "UNKNOWN",
        "robots_reviewed": false,
        "tos_reviewed": false,
        "redistribution_status": "UNKNOWN",
        "personal_data": "UNASSESSED",
        "reviewer": null,
        "reviewed_at": null
      },
      "cited_source_url": null,
      "lineage": {
        "synthetic": true,
        "scenario": "issue_1_state_machine",
        "note": "全文、主体、来源和时间均为虚构测试材料"
      }
    },
    {
      "id": "demo_replacement",
      "event_id": "demo_supply_v2",
      "evidence_type": "delivery",
      "source_url": "https://example.invalid/synthetic/replacement",
      "source_domain": "example.invalid",
      "source_tier": "T1",
      "published_at": "2026-05-28T08:00:00Z",
      "first_seen_at": "2026-05-28T08:00:00Z",
      "retrieved_at": "2026-05-28T08:00:00Z",
      "processed_at": "2026-05-28T08:00:00Z",
      "raw_fingerprint": "ff7a2ef966e5bb114177258d346a2ba0001a6daa85614a7f7db5cc688735b7bf",
      "fingerprint_scope": "synthetic_document",
      "source_independence_group": null,
      "content_excerpt": "虚构客户公告：V2 正式替代 V1；V1 的旧供货主张不再作为当前版本。",
      "access_mode": "synthetic_fixture",
      "original_source_checked": true,
      "legal_basis": {
        "public_access": "UNKNOWN",
        "auth_required": "UNKNOWN",
        "robots_reviewed": false,
        "tos_reviewed": false,
        "redistribution_status": "UNKNOWN",
        "personal_data": "UNASSESSED",
        "reviewer": null,
        "reviewed_at": null
      },
      "cited_source_url": null,
      "lineage": {
        "synthetic": true,
        "scenario": "issue_1_state_machine",
        "note": "全文、主体、来源和时间均为虚构测试材料"
      }
    }
  ],
  "reviews": [
    {
      "id": "review_qualification",
      "evidence_id": "demo_qualification",
      "at": "2026-04-03T08:15:00Z",
      "decision": "SUPPORT",
      "independence_group": "origin_qualification",
      "supporting_quote": "虚构资格资料：演示加速卡 V1 已通过演示客户的资格审核。",
      "reviewer": "synthetic_fixture",
      "reason": "模拟审核，供回放测试"
    },
    {
      "id": "review_pilot",
      "evidence_id": "demo_pilot",
      "at": "2026-04-10T08:15:00Z",
      "decision": "SUPPORT",
      "independence_group": "origin_delivery",
      "supporting_quote": "虚构交付记录：演示客户已收到演示加速卡 V1 的试产批次。",
      "reviewer": "synthetic_fixture",
      "reason": "模拟审核，供回放测试"
    },
    {
      "id": "review_reprint",
      "evidence_id": "demo_reprint",
      "at": "2026-04-11T08:15:00Z",
      "decision": "SUPPORT",
      "independence_group": "origin_qualification",
      "supporting_quote": "虚构转载：根据资格资料，演示加速卡 V1 已通过演示客户的资格审核。",
      "reviewer": "synthetic_fixture",
      "reason": "模拟审核，供回放测试"
    },
    {
      "id": "review_confirmation",
      "evidence_id": "demo_confirmation",
      "at": "2026-05-21T08:15:00Z",
      "decision": "CONFIRM",
      "independence_group": "origin_customer_confirmation",
      "supporting_quote": "虚构客户公告：确认演示芯片厂为演示加速卡 V1 的供货方。",
      "reviewer": "synthetic_fixture",
      "reason": "模拟审核，供回放测试"
    },
    {
      "id": "review_counter",
      "evidence_id": "demo_counter",
      "at": "2026-05-25T08:15:00Z",
      "decision": "COUNTER",
      "independence_group": "origin_counter",